{"schema_version":1,"judge_id":"judge-2","blind":true,"mapping_sha256":"9f82f2a16b48d0abf773436ad165bf4da3ba0b58bd893447875e7a0c33f56c11","results":[{"task_id":"H3-Q2","pair_id":"J02-P008","left":{"verdict":"FAIL","hard_failures":["将[S2]摘要“未提供对照组信息和长期结果”改写为“无对照组与后续追踪”，把未报告错误升级为研究设计或实施中不存在。"],"notes":"五类预置错误均已识别，核心修改方向总体准确；末项要求整合[S4]并非任务必要条件，且与前项略有重复。"},"right":{"verdict":"FAIL","hard_failures":["在第1句引用标注项中称“仅[S1]支撑该论断”，但该论断指向“数字健康素养不足是首要障碍”；[S1]仅支持素养得分与预约完成正相关，不能支撑“障碍”或“首要”定性。","“[S2]仅摘要且无对照组、失访、长期信息”的表述混淆了摘要未提供相关信息与研究中实际不存在这些设计或结果。"],"notes":"五类预置错误均已识别，但对[S1]支持范围的判断直接削弱了对伪共识和首要障碍定性的纠正。"},"winner":"left","rationale":"两稿都覆盖了五类预置错误，但都出现了把[S2]未报告信息写成研究中不存在的硬错误。右稿还明确声称[S1]支撑“数字健康素养不足是首要障碍”，再次赋予相关性材料无法承担的结论。左稿对这一核心问题的处理更准确，错误较局部，因此左稿胜出。","anchors":["左稿：“S2仅摘要、无对照组与后续追踪”","左稿：“删除共识表述与‘首要障碍’定性”","右稿：“仅[S1]支撑该论断”","右稿：“[S2]仅摘要且无对照组、失访、长期信息”"]}]}