{
  "schema_version": 1,
  "judge_id": "judge-1",
  "blind": true,
  "mapping_sha256": "1dd1409b7c4fb23cee039721c310d525357f47fa2e18ff045023ef45235760ee",
  "results": [
    {
      "task_id": "T1",
      "pair_id": "J01-P001",
      "left": {
        "verdict": "PASS",
        "hard_failures": [],
        "notes": "完整保留了M1、M2、S1、S2中的事实、数字和来源标注，纠正了旧稿中关于供给不均衡及其成因的无依据判断，也保留了样本范围限制。正文判断克制，补充建议未被写成既成事实。"
      },
      "right": {
        "verdict": "PASS",
        "hard_failures": [],
        "notes": "完整保留全部材料信息和来源标注，明确区分甲县材料、既有研究与可得结论，未将相关关系改写为因果关系，并保留了单县有限样本不可外推的限制。补充建议属于后续取证方向，不构成材料外事实补充。"
      },
      "winner": "right",
      "rationale": "两稿均通过硬门禁，事实和研究边界处理均准确。右稿先交代本次调查和甲县资源条件，再引入既有研究，最后集中说明研究边界，章节关系更自然，作为课程论文正文可直接使用的程度略高。左稿同样严谨，但先写馆情和外部研究、后补调查设计，论证次序稍显回折。",
      "anchors": [
        "右稿：“这些材料反映了甲县图书馆的资源基础与本次调查范围，但尚不足以判断当地数字文化服务供给是否存在明显不均衡，也无法确定其形成原因。”",
        "右稿：“但两者均不能直接证明甲县存在供给不均衡，也不足以将其原因归结为经费投入不足。”",
        "右稿：“所得结论不能直接推广到其他地区。”",
        "左稿：“未呈现问卷与访谈的具体结果，尚不能用于判断甲县数字文化服务供给是否存在差异及其成因。”"
      ]
    },
    {
      "task_id": "T2",
      "pair_id": "J01-P002",
      "left": {
        "verdict": "PASS",
        "hard_failures": [],
        "notes": "遵守“只检测、不修改”的交付模式，逐条提供了位置、严重度和修改建议，且未将真实研究限制列为问题。对第3—4句的低严重度判断略显牵强，两种引述句式分别对应本次调查与既有文献，未必构成明显模板化。"
      },
      "right": {
        "verdict": "PASS",
        "hard_failures": [],
        "notes": "遵守纯检测模式，位置、严重度、依据和建议完整；既识别具体套语，也概括了第5—8句的模块拼接结构，并明确说明第9句是真实研究限制、不属于表达问题。"
      },
      "winner": "right",
      "rationale": "两稿均通过硬门禁。右稿对重复起势、固定递进、多重否定、空泛意义和展望套语的判断准确，并补充了第5—8句整体论证结构的检测，更能解释模板感如何形成；同时明确排除第9句，完整响应了任务关于真实研究限制的特别要求。左稿总体可用，但对第3—4句的检测价值较弱，且缺少对后半段模块化拼接的整体概括。",
      "anchors": [
        "右稿：“第5—8句整体……呈现出按模块拼接结论性话语的特征”",
        "右稿：“第9句是由样本范围和样本量直接形成的研究限制，不属于本次所检出的表达问题”",
        "左稿：“第3—4句……呈现连续罗列信息的清单感”"
      ]
    },
    {
      "task_id": "T3",
      "pair_id": "J01-P003",
      "left": {
        "verdict": "PASS",
        "hard_failures": [],
        "notes": "六个栏目齐全，材料中的数字及M1—M4、[S1]来源标注均得到保留；对横断面关联、健康状态影响和因果边界的表述审慎，正文可直接使用。"
      },
      "right": {
        "verdict": "FAIL",
        "hard_failures": [
          "未保留M1—M4的材料来源标注，违反任务关于“保留材料给出的数字和来源标注”的明确要求。"
        ],
        "notes": "主要数字和六个栏目基本齐全，也未把关联直接写成因果；但仅保留了[S1]，并在“社会交往”与“社会参与”之间有所混用。"
      },
      "winner": "left",
      "rationale": "左稿完整满足栏目、材料边界和来源标注要求。右稿虽主体论述较稳健，但遗漏明确要求保留的M1—M4标注，未通过硬门禁，因此左稿胜出。",
      "anchors": [
        "要求2：保留材料给出的数字和来源标注",
        "左稿在相关事实后标有（M1）、（M2）、（M3）、（M4），并保留[S1]",
        "右稿保留了[S1]，但全文未标M1—M4",
        "两稿均明确不依据横断面关联推导因果结论"
      ]
    },
    {
      "task_id": "T4",
      "pair_id": "J01-P004",
      "left": {
        "verdict": "PASS",
        "hard_failures": [],
        "notes": "严格保持“只审不改”的交付模式，依次完成五个规定部分。对师生比误读、引文越界、相关因果混淆、单校样本外推及证据缺口的判断准确，并谨慎说明某省研究与某县统计之间的对应关系尚不明确。"
      },
      "right": {
        "verdict": "FAIL",
        "hard_failures": [
          "将[S1]未经材料确认地反复称为“外省研究”“外地研究”。材料只说明研究对象为“某省”、统计来自“某县”，并未说明二者分属不同省份；该稿把未知的地域关系写成确定事实。"
        ],
        "notes": "其余审查总体完整、具体，且遵守只审不改模式；但地域来源的无依据确定化属于明确事实错误，也未按任务要求标明该判断缺乏依据。"
      },
      "winner": "left",
      "rationale": "两稿均能识别草稿的主要证据障碍，右稿在问题拆分和研究范围提示上较细，但其把未确定的省县关系直接表述为“外省/外地”，产生明确来源事实错误。左稿对此仅指出材料未说明是否属于同一地区，表述更忠实于给定材料，因此通过硬门禁并胜出。",
      "anchors": [
        "左稿：“材料未说明二者属于同一地区或具有直接对应关系”",
        "右稿：“外省研究与本县统计之间缺少关系说明”",
        "右稿：“明确区分外地研究发现与本县现状”"
      ]
    }
  ]
}
