{"schema_version":1,"judge_id":"judge-2","blind":true,"mapping_sha256":"1653b903ad21147a0d22e3853ebca8c8cc2f75cf7719d8831e9cbd74b5693178","results":[{"task_id":"L01","pair_id":"J02-P001","left":{"verdict":"PASS","hard_failures":[],"notes":"完整遵守“只审不改”及五部分输出要求，准确识别文书记载与实际履行混同、征求意见稿效力错误、效率与净收益无数据支撑、有限地方样本不当外推等全部核心阻断问题。数字核验、访谈边界和方法缺口也处理充分。"},"right":{"verdict":"PASS","hard_failures":[],"notes":"完整遵守审查模式和五部分结构，核心事实、规范状态与研究边界判断准确。除覆盖全部阻断问题外，还明确指出37.9%的分母仅是纳入样本、公开时间不能当然证明全部文书适用正式办法，以及违法判断须核实义务主体和触发条件，审查颗粒度更细。"},"winner":"right","rationale":"两稿均通过硬门禁，均可直接作为审查意见使用。右稿小胜：它在共同识别的四类核心越界之外，进一步拆出了样本比例被扩大为甲市总体、文书公开时间与规范适用时间可能错位、违法性判断缺少义务主体及触发条件等问题，使规范适用和样本边界审查更周密，用户后续核验路径也更明确。左稿并无实质错误，但对这些问题的展开略少。","anchors":["右稿分节问题3明确区分样本比例与甲市全部事项","右稿分节问题7核查义务主体、适用事项、履行期限和实际行为","右稿补充与修改建议4提示公开时间不能替代规范适用性核验","两稿均准确保留11÷29约为37.9%的计算结论及其有限含义","两稿均将效率、监管缺位、净收益和全国趋势判断列为证据不足"]}]}
