{"schema_version":1,"judge_id":"judge-1","blind":true,"mapping_sha256":"2679a30ebcb68b653080d136ce3571866755c2e4d39ce57c1825b03b5136a0fc","results":[{"task_id":"H03-R2","pair_id":"J01-P004","left":{"verdict":"PASS","hard_failures":[],"notes":"更正后的样本数、分组人数、均值、差值和排除理由均准确，未残留禁用旧数字；因果、外推和测量边界交代充分。"},"right":{"verdict":"PASS","hard_failures":[],"notes":"完整落实全部更正，数字及章节关系一致；对同题前后测、非随机分组、样本代表性和行为测量边界的限定清楚。"},"winner":"right","rationale":"两稿均通过硬门禁。右稿小胜：结果部分将前后测、观看分组与不可作因果解释的限定衔接得更紧，讨论对题目熟悉、自行复习、组间不可比及测验结果不能替代实际操作能力的解释更系统，措辞也更克制。左稿整体可用，但“说明，微课可以作为……学习载体，学生……能够正确判断更多题目”略易产生效果归因色彩，虽然后文已作充分收束。","anchors":["两稿均使用有效样本104人、完整观看75人、未完整观看29人，并准确报告13.0、15.2、15.6、14.2及相应差值。","两稿均明确4份记录因后测早于最后一个单元开放而排除，且未出现禁止残留的旧数字。","右稿明确区分样本内正向变化与微课的确定提升效果，并逐项说明同题重复、无对照组和无随机分配的影响。","右稿对观看完成度与后测成绩的关系使用“对应关系”“不能视为独立效果”等限定，因果边界更稳。"]}]}
