{"schema_version":1,"judge_id":"judge-2","blind":true,"mapping_sha256":"1653b903ad21147a0d22e3853ebca8c8cc2f75cf7719d8831e9cbd74b5693178","results":[{"task_id":"L04","pair_id":"J02-P004","left":{"verdict":"PASS","hard_failures":[],"notes":"严格保持“只审不改”的表格模式，8项问题均有位置、问题、依据、建议动作和严重度；准确抓住理论统一性夸大、效果与因果证据不足、全称外推、技术决定论、异质证据不可直接合并，以及本节未完成章节任务等关键缺陷。末项将正文中的过程性自评与整体任务缺口合并处理，稍显宽泛，但不构成硬错误。"},"right":{"verdict":"PASS","hard_failures":[],"notes":"完整遵守审查模式和数量限制，事实、样本、来源性质及研究状态均与原文一致；对因果升级、有限样本外推、异质材料强行归并和章节关系缺失的判断准确。将“本论文材料与既有研究的关系未建立”和“自我诊断不应留在正文”拆分处理，定位与建议动作更清楚，严重度也更有层次。"},"winner":"right","rationale":"两稿均通过硬门禁，覆盖面也高度一致。右稿小胜：它把第三段的两个不同问题分别定位，既审查章节论证是否闭合，也单独指出过程性修改说明污染正文，便于作者逐项执行；同时对后几项采用“较严重”“中等”的分级，比左稿多处直接标为“严重”更符合问题性质。左稿同样可直接使用，但末项合并范围较大，后续修改对应关系略弱。","anchors":["两稿均未重写小节、未补充新文献，且均控制在8项以内","第一段末句的成本下降、满意度提升及“所有老年人”外推被两稿准确判为严重问题","第二段末句的“决定性因素”被两稿准确识别为缺乏比较或因果证据的技术决定论","右稿分别处理“第三段前两句”的材料关系缺口与“第三段末句”的过程性自评，定位更精确","右稿对局部结构问题的严重度分级较左稿更克制"]}]}
