{"schema_version":1,"judge_id":"judge-3","blind":true,"mapping_sha256":"dcb539c3121f238181725817324cc1571a12cd97aafc51611f7c2eb29db35c20","results":[{"task_id":"H01","pair_id":"J01-P001","left":{"verdict":"WARN","hard_failures":[],"notes":"数字、样本、时段、来源范围和非因果限制基本准确，章节与交付模式完整。但结论称线上预约与“较低的自报等待不确定感相联系”，而本研究仅记录49名使用者将“减少现场等待的不确定性”列为主要便利，未提供组间比较或不确定感水平测量；“较低”容易将[R1]的相关性表述移植为本研究结论，属局部可修复的轻度过强概括。"},"right":{"verdict":"PASS","hard_failures":[],"notes":"准确保留148份问卷、82人与66人分组、各项可重叠回答、18人访谈及调查时段；严格区分自报等待感受与实际等待时长，正确限定[R1]、[R2]并明确[R3]不能支持具体判断。结论保留横断面、自愿参与、无随机分组、无干预前数据和非因果边界，未提出超出材料的推广主张。"},"winner":"right","rationale":"两稿总体均能直接替换原文，事实和研究边界处理较稳。右稿略胜，主要因为它始终把本研究结果表述为特定样本的便利感受与使用困难，并在结论中避免了左稿“较低的自报等待不确定感相联系”这一缺乏本地比较依据的措辞；同时明确交代[R3]仅有元数据、不能支持具体观点，引用核对更完整。","anchors":["左稿：“线上预约与部分参与者较低的自报等待不确定感相联系”","右稿：“不能将自报的等待感受表述为实际等待时间下降”","右稿：“[R3]目前仅有题名和DOI元数据，缺少摘要与全文，不能用于支持……具体判断”"]}]}
