{
  "schema_version": 1,
  "judge_id": "judge-1",
  "blind": true,
  "mapping_sha256": "c36c9ee88a6ce31831aaac9e13c93ac350ef8f7172d677255a174ab972370057",
  "results": [
    {
      "task_id": "BC01",
      "pair_id": "J01-P001",
      "left": {
        "verdict": "FAIL",
        "hard_failures": [
          "正文超过任务规定的700—900个汉字范围。"
        ],
        "notes": "事实、数字、研究状态和边界控制基本准确，论证也较完整，但篇幅明显超出硬性要求，增加了后续压缩成本。"
      },
      "right": {
        "verdict": "WARN",
        "hard_failures": [],
        "notes": "篇幅和章节模式符合要求，能够准确比较两室差异并保留因果、样本和时段边界。局部将“提到某因素的人数”表述为“因素被提及的次数”，计量单位不够严谨；“设备使用的便利程度”也略超出材料原意，但均可通过局部改写修复。"
      },
      "winner": "right",
      "rationale": "左稿在事实解释和边界限定上更细致，但违反700—900个汉字的硬性篇幅要求，须判FAIL。右稿没有改变核心事实或研究状态，完整覆盖比较、访谈解释限度和研究边界，仅存在两处可局部修复的措辞问题，因此右稿获胜。",
      "anchors": [
        "左稿篇幅超出700—900个汉字的规定",
        "右稿将受访人数写成“被提及的次数”",
        "右稿明确指出记录不等于不同学生",
        "右稿未将空间条件与选座差异升级为因果关系"
      ]
    },
    {
      "task_id": "BC02",
      "pair_id": "J01-P002",
      "left": {
        "verdict": "PASS",
        "hard_failures": [],
        "notes": "完整使用最新版样本、满意度、完成情况和访谈数据，准确区分重复记录清理与样本流失，并持续保留自选分组、日志口径、目的抽样及无因果识别等边界。结果与讨论分工清楚，结尾明确指出现有证据不能回答的核心问题。"
      },
      "right": {
        "verdict": "PASS",
        "hard_failures": [],
        "notes": "事实、数字、术语和研究状态均与材料一致，未残留旧稿数据，也未将描述性差异升级为因果效果。局部表述如“完成状态更为集中”不够准确，“两组均值的差异较小”也略带缺乏判据的评价，但未改变核心结论。"
      },
      "winner": "left",
      "rationale": "两稿均通过硬门禁，均可直接使用。左稿小胜：其对完成比例差异的表述更准确，对访谈线索与可能解释的连接更克制，且避免了右稿“完成状态更为集中”这一含义含混的说法。左稿在结果呈现、限制说明和最终证据边界之间衔接更稳，用户后续修改成本略低。",
      "anchors": [
        "左稿明确写明删除的10条为重复提交记录，不属于中途退出或样本流失。",
        "左稿将0.2分和6.8个百分点严格限定为观察性差异，并明确排除因果表述。",
        "两稿都说明日志不记录有效学习时长、阅读深度或任务质量。",
        "两稿都保留了12人目的抽样、7人和4人回答可重叠且不能外推总体比例的边界。",
        "右稿“完成状态更为集中”未准确对应完成比例较高这一结果。"
      ]
    },
    {
      "task_id": "BC03",
      "pair_id": "J01-P003",
      "left": {
        "verdict": "PASS",
        "hard_failures": [],
        "notes": "完整覆盖最新版口径传播、研究状态、因果边界、术语、表图及概念未决状态；保持只审不改，问题表字段齐全。"
      },
      "right": {
        "verdict": "FAIL",
        "hard_failures": [
          "阻断项第2项声称访谈人数在摘要、第三章、第四章和结论中“均为24人”，但摘要并未写明24名访谈对象；这是对现行文本的明确事实误报。"
        ],
        "notes": "其余审查总体充分，且对访谈内容需按18人重新复核、图4-1证明范围等问题说明较细，但明确事实错误触发硬门禁。"
      },
      "winner": "left",
      "rationale": "左稿准确完成了指定的全文传播审查，未发现硬错误。右稿虽然更细致地提示了部分下游复核事项，但将摘要误报为含有“24人访谈”这一明确事实错误；按硬错误优先规则，失败侧不得获胜。",
      "anchors": [
        "右稿阻断项2：“访谈人数在摘要、第三章、第四章和结论中均为24人”",
        "摘要原文仅称“以214名……为对象，结合问卷、访谈和平台日志”，未出现24人访谈数量",
        "左稿问题表分别定位第三章、第四章和结论中的24人残留，未将其错误归入摘要"
      ]
    }
  ]
}
