{"schema_version":1,"judge_id":"judge-2","blind":true,"mapping_sha256":"9f82f2a16b48d0abf773436ad165bf4da3ba0b58bd893447875e7a0c33f56c11","results":[{"task_id":"H4-Q2","pair_id":"J02-P011","left":{"verdict":"PASS","hard_failures":[],"notes":"完整形成效果证据、使用体验和证据边界的连贯综述；准确保留研究设计、数值、比较对象及[S4]、[S5]的来源限制，也明确避免比较不可通约指标。"},"right":{"verdict":"FAIL","hard_failures":["将[S3]中并列出现的速度偏好与表达趋同担忧改写为“反馈越快速，越容易导向同质化的表述”，新增了访谈没有支持的因果或机制关系。","声称研究“多在单一语种、单一机构内进行”，但来源卡未提供[S1]的写作语种，也未说明[S2]的机构数量，属于材料外事实概括。"],"notes":"整体结构符合三部分要求，也正确限制了[S4]和[S5]的用途，但新增因果机制和研究情境信息构成硬错误。"},"winner":"left","rationale":"左稿对[S1]与[S2]共同测量的论证表现进行了合法比较，同时保留不同对照条件和不可通约指标的边界；右稿虽有连贯结构，却把访谈中的并列感受升级为速度导致表达同质化的机制，并补入来源未给出的语种和机构概括，故左稿胜出。","anchors":["“由于修订采纳率与语法错误密度的计量单位不同，无法直接将两者的大小加以比较”","“[S4]只能使用摘要提供的有限信息”","“反馈越快速，越容易导向同质化的表述”","“多在单一语种、单一机构内进行”"]}]}