{"schema_version":1,"judge_id":"judge-2","blind":true,"mapping_sha256":"b3075778eff33cb9fdf3975cff540c488ab71c520a942b578c7e7cb5f9651d46","results":[{"task_id":"H03-R1","pair_id":"J02-P003","left":{"verdict":"PASS","hard_failures":[],"notes":"完整呈现结果与讨论，数字计算一致，严格区分样本内变化、组间关联与因果结论，并充分说明重复测验、选择差异、测量范围和外推边界。"},"right":{"verdict":"WARN","hard_failures":[],"notes":"整体事实准确、结构完整、因果限定充分；但将微课称为“短时”载体缺少材料依据，属于局部可修复的无来源特征判断。"},"winner":"left","rationale":"两稿均基本达到直接使用标准，且未把测验变化升级为实际安全能力或事故减少。左稿的事实边界更严谨，进一步给出正确率换算，并较系统地区分重复测验、组间自选择、真实操作测量缺失和样本外推限制；右稿同样扎实，但“短时”表述引入了材料未提供的信息。左稿小胜。","anchors":["左稿：平均正确率由65.5%变为77.0%，计算与13.1/20、15.4/20一致","左稿：明确指出前后差异不能确定由微课造成，1.5题组间差异不能解释为完整观看导致","左稿：明确区分情境判断题表现、真实实验操作、违规行为和事故结果","右稿：“短时、分单元呈现的安全微课”中的“短时”无材料依据","右稿：对重复作答、题目熟悉、选择差异、样本局限和测量局限的讨论总体充分"]}]}
