{"schema_version":1,"judge_id":"judge-2","blind":true,"mapping_sha256":"1653b903ad21147a0d22e3853ebca8c8cc2f75cf7719d8831e9cbd74b5693178","results":[{"task_id":"L03","pair_id":"J02-P003","left":{"verdict":"PASS","hard_failures":[],"notes":"四个规定标题齐全，来源使用和证据限定准确；未将相关关系升级为因果，明确区分低发帖、阅读与学习，并妥善限制了[S3]和小样本访谈的用途。"},"right":{"verdict":"WARN","hard_failures":[],"notes":"总体遵守事实边界，但对[S4]作了若干材料未直接提供的过程性扩写，如“推迟表达”“发现相近观点已经出现后”“优先浏览”；“将在线讨论沉默从单纯的‘缺席’现象转化为……”也略带未经现有材料证明的研究演进判断。问题局部可删改，不改变主体结论。"},"winner":"left","rationale":"两稿均完成规定结构并基本守住来源边界。左稿对相关性、日志证据、访谈样本和[S3]可用范围的表述更克制，论点与证据对应更严密。右稿整体可用，但增加了来源未明示的行为过程，并以“转化”为研究进展作概括，后续修改成本略高。","anchors":["左稿：“这些内容只能反映受访者的经验，不能概括为大学生在线沉默的普遍动机。”","左稿：“无法确认其研究设计和结论，故不能据此说明社会临场感与沉默之间存在何种关系。”","右稿：“学生可能因害怕出错而推迟表达……还可能因任务压力而优先浏览、减少撰写。”","右稿：“将在线讨论沉默从单纯的‘缺席’现象转化为需要分层识别的参与状态。”"]}]}
