{
  "schema_version": 1,
  "judge_id": "judge-3",
  "blind": true,
  "mapping_sha256": "dcb539c3121f238181725817324cc1571a12cd97aafc51611f7c2eb29db35c20",
  "results": [
    {
      "task_id": "H01",
      "pair_id": "J01-P001",
      "left": {
        "verdict": "WARN",
        "hard_failures": [],
        "notes": "数字、样本、时段、来源范围和非因果限制基本准确，章节与交付模式完整。但结论称线上预约与“较低的自报等待不确定感相联系”，而本研究仅记录49名使用者将“减少现场等待的不确定性”列为主要便利，未提供组间比较或不确定感水平测量；“较低”容易将[R1]的相关性表述移植为本研究结论，属局部可修复的轻度过强概括。"
      },
      "right": {
        "verdict": "PASS",
        "hard_failures": [],
        "notes": "准确保留148份问卷、82人与66人分组、各项可重叠回答、18人访谈及调查时段；严格区分自报等待感受与实际等待时长，正确限定[R1]、[R2]并明确[R3]不能支持具体判断。结论保留横断面、自愿参与、无随机分组、无干预前数据和非因果边界，未提出超出材料的推广主张。"
      },
      "winner": "right",
      "rationale": "两稿总体均能直接替换原文，事实和研究边界处理较稳。右稿略胜，主要因为它始终把本研究结果表述为特定样本的便利感受与使用困难，并在结论中避免了左稿“较低的自报等待不确定感相联系”这一缺乏本地比较依据的措辞；同时明确交代[R3]仅有元数据、不能支持具体观点，引用核对更完整。",
      "anchors": [
        "左稿：“线上预约与部分参与者较低的自报等待不确定感相联系”",
        "右稿：“不能将自报的等待感受表述为实际等待时间下降”",
        "右稿：“[R3]目前仅有题名和DOI元数据，缺少摘要与全文，不能用于支持……具体判断”"
      ]
    },
    {
      "task_id": "H02",
      "pair_id": "J01-P002",
      "left": {
        "verdict": "PASS",
        "hard_failures": [],
        "notes": "完整交付五部分，按硬冲突优先组织问题表，准确识别样本量、虚构方法、变量替换、来源越界、因果升级、全国外推及表图引用等核心问题。对论文中大量修订过程话语的文体污染提示不如右稿集中。"
      },
      "right": {
        "verdict": "PASS",
        "hard_failures": [],
        "notes": "完整交付五部分，问题表顺序与指定审查维度基本一致；除核心数据、方法、因果和来源问题外，还明确识别“旧稿所称”“应当删除”等修订记录混入论文正文的问题，证据与动作对应清楚。"
      },
      "winner": "right",
      "rationale": "两稿均通过硬门禁，主要事实判断一致且可直接用于全文审查。右稿小胜，原因是它在覆盖全部核心阻断项之外，单列并系统处理了论文中的旧稿痕迹和审稿式过程话语，更充分回应了章节关系与文体漂移审查要求；左稿虽多处清理旧数据和旧结论，但未同等集中识别这一全文性根因。",
      "anchors": [
        "第三章3.3的双人编码、饱和度检验和0.91系数与实际记录矛盾",
        "摘要、5.4、第六章及图4-1的214/24与196/18冲突",
        "总体服务满意度被替换为数字平台满意度",
        "来源[1]—[4]均不足以支持因果或全国推广",
        "右稿第24项集中识别修订记录和审稿提示混入论文文体"
      ]
    },
    {
      "task_id": "H03-R1",
      "pair_id": "J01-P003",
      "left": {
        "verdict": "PASS",
        "hard_failures": [],
        "notes": "章节完整，数字、对象、来源和研究状态一致；明确限定前后测变化与组间差异均不能作因果解释，并充分交代同题复测、样本范围、失访及行为测量缺失等边界。个别“积极变化”“可能适合作为”措辞略带评价和推测，但未越过硬门禁。"
      },
      "right": {
        "verdict": "PASS",
        "hard_failures": [],
        "notes": "章节和输出模式符合要求，计算所得正确率与原始数据一致；对同题复测、无对照、无随机分配、组间混杂、样本外推及实际行为缺失均作了清楚限定，未将测验变化升级为实际能力或事故减少。"
      },
      "winner": "right",
      "rationale": "两稿均通过硬门禁且完成度很高。右稿小胜：论述更克制紧凑，对前后变化、观看完成度和真实安全行为三个层次的区分更清楚；“一定对应关系”“不能直接解释为”“无法判断是否会转化”等限定前后一致，用户后续压缩或纠偏成本较低。左稿对失访偏倚的讨论更明确，但“积极变化”和“微课可能适合作为……载体”略早于现有设计能够稳妥支持的范围，虽不构成硬错误，仍增加少量修改成本。",
      "anchors": [
        "左稿：“该变化仅能描述为样本内前后测成绩的差异”",
        "左稿：“不能将2.3题的平均增量全部归因于微课”",
        "左稿：“测验成绩的变化并不等同于实际操作能力”",
        "右稿：“这一前后差异仅能作为样本内测验结果的描述”",
        "右稿：“不能把两组间1.5题的差距直接归因于是否完整观看”",
        "右稿：“更不能推断微课已经提高实际安全能力或减少实验室事故”"
      ]
    },
    {
      "task_id": "H03-R2",
      "pair_id": "J01-P004",
      "left": {
        "verdict": "PASS",
        "hard_failures": [],
        "notes": "更正后的样本数、分组人数、各项均值和4份记录的排除理由均准确，未残留禁用旧数值；对前后测差异、观看完成情况、测量边界和外推范围的限定完整。"
      },
      "right": {
        "verdict": "PASS",
        "hard_failures": [],
        "notes": "关键事实和更正数据准确，未残留禁用旧数值，章节与输出模式符合要求。局部使用“有所改善”“能够正确判断更多题目”等稍偏肯定的表述，但随后充分说明同题测验、无对照组及非随机分配等限制，未构成因果升级。"
      },
      "winner": "left",
      "rationale": "两稿均通过硬门禁。左稿对同题重复测量、样本选择、组间不可比、测验表现与真实操作能力的区别阐释更严密，结论措辞也更克制；右稿整体可用，但个别表述需进一步收紧，后续修改成本略高。因此左稿小胜。",
      "anchors": [
        "左稿明确将2.2题界定为“样本内知识判断表现变化的描述”，不写成确定效果。",
        "左稿同时指出未完成流程者可能产生选择差异，并区分情境判断得分与真实实验操作。",
        "右稿“作答结果有所改善”“能够正确判断更多题目”的措辞较肯定，但后文已作必要限定。"
      ]
    },
    {
      "task_id": "H03-R3",
      "pair_id": "J01-P005",
      "left": {
        "verdict": "WARN",
        "hard_failures": [],
        "notes": "核心数字、来源、研究状态及证据边界均符合要求，但开头称104人“完整完成前测、微课和后测”，与后文29人至少跳过1个微课单元存在局部表述冲突。后文已用平台记录和具体人数准确限定，属于可修复的一致性问题。"
      },
      "right": {
        "verdict": "PASS",
        "hard_failures": [],
        "notes": "采用最新版数字，交代平台记录、同题前后测、无对照和非随机分配等限制；未将相关关系升级为因果，也明确限定真实操作、长期保持、事故变化及样本外推广边界。结论模式完整，可直接使用。"
      },
      "winner": "right",
      "rationale": "两稿均守住主要事实和研究边界。右稿胜在全文表述更自洽：既准确报告104人有效样本，又避免将所有人描述为完整完成全部微课；主要结果、因果限制、测量边界、适用范围和未实施的后续设计衔接紧密。左稿内容更细，但“完整完成微课”与29人跳过单元的内部冲突增加了修改成本。",
      "anchors": [
        "左稿：“最终纳入104名完整完成前测、微课和后测的学生”与“29人至少跳过1个单元”存在表述冲突。",
        "右稿：“组间成绩差别只能作为观看完成情况的描述性结果，不能直接归结为完整观看带来的独立作用。”",
        "右稿：“这些设计均属于后续研究方向，尚未在本研究中实施。”"
      ]
    },
    {
      "task_id": "H04",
      "pair_id": "J01-P006",
      "left": {
        "verdict": "FAIL",
        "hard_failures": [
          "正文超过用户要求的900—1200个汉字范围。"
        ],
        "notes": "事实、数字、研究边界和禁止项总体处理准确，但“经页面容量限定”缺乏材料依据。"
      },
      "right": {
        "verdict": "FAIL",
        "hard_failures": [
          "正文超过用户要求的900—1200个汉字范围。"
        ],
        "notes": "事实与研究边界总体准确；对主题归类边界及页面链接作用的分析较具体，但“亲历者”身份并非材料明确给出。"
      },
      "winner": "right",
      "rationale": "两稿均因超出规定篇幅而未通过硬门禁。相较之下，右稿对主题组织造成的归类边界、时间连续性弱化以及链接补充作用分析更完整，段落关系更紧，后续压缩成本略低；其“亲历者”表述可局部改为“讲述者”。",
      "anchors": [
        "两稿均完整保留67页及28、19、12、8页的材料构成。",
        "两稿均明确缺少访问量、停留时长、用户评论和线下参观数据，未评价传播效果或用户偏好。",
        "右稿指出兼具空间、行业和生活属性的内容会受到主题归类边界影响，较直接回应“叙事取舍”。",
        "左稿将文书节选归因于“页面容量限定”，超出了材料能够支持的范围。"
      ]
    }
  ]
}
