{"schema_version":1,"judge_id":"judge-2","blind":true,"mapping_sha256":"9f82f2a16b48d0abf773436ad165bf4da3ba0b58bd893447875e7a0c33f56c11","results":[{"task_id":"H1-Q3","pair_id":"J02-P003","left":{"verdict":"WARN","hard_failures":[],"notes":"事实、数字和来源边界基本准确，篇幅符合要求；但整体仍按来源逐项展开，限制语较密，结尾“协助对候诊时间的短期变化”略有因果歧义，所幸前文已明确限定为协助前后变化。"},"right":{"verdict":"FAIL","hard_failures":["将[S1]材料未提供的数据取得方式新增为“问卷数据”，属于材料外事实。"],"notes":"其余主要边界控制较稳，但把[S3]表述为“文献确实存在”也强于材料允许的“相关题名存在”。"},"winner":"left","rationale":"左稿虽有逐项罗列和局部措辞负担，但未明显改变来源事实，并分别控制了横断面相关、前后变化、协助次数记录和题名元数据的证据边界。右稿为[S1]擅自补入“问卷数据”这一方法信息，触发硬错误，因此左稿胜出。","anchors":["左：“仅支持素养与完成行为之间的横断面相关，不能据此推论因果”","左：“记录单位是协助次数而非27名不同居民”","右：“312名65岁以上居民的问卷数据”","右：“文献确实存在”"]}]}