{"schema_version":1,"judge_id":"judge-2","blind":true,"mapping_sha256":"9f82f2a16b48d0abf773436ad165bf4da3ba0b58bd893447875e7a0c33f56c11","results":[{"task_id":"H1-Q2","pair_id":"J02-P002","left":{"verdict":"FAIL","hard_failures":["违反“只输出正文、不加题目”的明确要求，额外输出了题目。","将来源中的调整后β=0.28改写为“相关系数为0.28”，改变了统计量性质。","“数字健康素养被普遍视为影响使用的重要因素”是材料未提供的领域性共识判断。"],"notes":"其余段落大体区分了横断面关联、干预前后变化、个案记录和仅有题名的来源，但硬错误已使成稿不可交付。"},"right":{"verdict":"WARN","hard_failures":[],"notes":"事实、统计量、因果边界和来源层级控制基本准确，篇幅及交付形式符合要求；各来源逐段展开稍显机械，“一次协助个案中”与随后“27次协助记录”的搭配也略有歧义，但不改变记录单位。"},"winner":"right","rationale":"左稿存在禁止输出题目、误报统计量和无来源共识判断等硬错误。右稿没有这些硬错误，正确限制了横断面关联、无对照前后变化、个案完成记录及仅题名来源的解释范围，并在末段完成边界综合，故右稿胜出。","anchors":["左稿：“社区老年人数字医疗服务使用研究”","左稿：“数字健康素养被普遍视为影响使用的重要因素”","左稿：“调整后相关系数为0.28”","右稿：“只能说明这一关联，不能据此判断数字健康素养对服务使用的因果作用”","右稿：“此处仅能说明该题名存在，无法据此概括其具体观点或研究发现”","右稿：“也不把它们合成为同一障碍、共同机制或统一效果”"]}]}