{"schema_version":1,"judge_id":"judge-2","blind":true,"mapping_sha256":"b3075778eff33cb9fdf3975cff540c488ab71c520a942b578c7e7cb5f9651d46","results":[{"task_id":"H04","pair_id":"J02-P006","left":{"verdict":"FAIL","hard_failures":["正文明显超过用户规定的900—1200个汉字，违反输出长度要求。"],"notes":"事实、数字、研究范围和禁止项总体保持准确，完整讨论了三类材料与主题组织，但篇幅超限；“经页面容量限定”还加入了材料未说明的具体原因。"},"right":{"verdict":"FAIL","hard_failures":["正文明显超过用户规定的900—1200个汉字，违反输出长度要求。"],"notes":"事实边界和结尾限定完整，主题归类边界的分析较具体，但同样未满足长度要求；“亲历者”身份并非材料明确提供，宜改为更克制的“讲述者”。"},"winner":"right","rationale":"两稿均因篇幅明显超出硬性范围而失败。相较之下，右稿更紧凑，对主题组织既建立横向联系又形成归类边界的取舍解释更充分，且减少了左稿关于“页面容量”的无依据归因，后续压缩修改成本略低，因此右稿小胜。","anchors":["左稿：“经页面容量限定的文本片段”——材料只说明文书为节选，未说明节选由页面容量造成。","右稿：“四个主题本身构成了材料归类的边界”——具体揭示了主题组织突出部分关联、弱化其他关联的取舍。","两稿均明确说明缺少访问量、停留时长、用户评论和线下参观数据，未据此评价传播效果或推断用户偏好。","两稿结尾均保留“公开页面的材料组织不等同于档案完整性或城市历史全貌”的必要限定。"]}]}
