{"schema_version":1,"judge_id":"judge-2","blind":true,"mapping_sha256":"1b396143f9d28b35aff0acee1229376987434790506bc0f732f8e1212ab92b0e","results":[{"task_id":"R2","pair_id":"J02-P002","left":{"verdict":"PASS","hard_failures":[],"notes":"遵守“只检测、不修改”的交付模式，逐项给出位置、严重度和修改建议，并明确排除真实研究限制。整体诊断充分，但“连续保留”表述略显含混。"},"right":{"verdict":"PASS","hard_failures":[],"notes":"遵守纯检测模式，问题定位、依据和建议对应清楚，且正确保留并排除第9句的真实研究限制。对固定递进造成的材料外拔高说明更明确。"},"winner":"right","rationale":"两稿均通过硬门禁，覆盖的模板化问题也基本相同。右稿凭借独立的“依据”栏、对第5句材料支撑边界的明确提示，以及更准确的“尚无定论—未来深化—意义深远”结构概括，略微降低了后续修改成本；左稿整体判断可靠，但个别概括不如右稿清晰。","anchors":["两稿均未输出改写后的全文","两稿均明确第9句真实研究限制不属于表达问题","右稿第5句指出递进层次缺少材料支撑","右稿对第6—8句的模板组合概括更清楚","左稿“连续保留”一语含义不够明确"]}]}